date,number,title,url,desc,guests
2013-12-23,BO2013.1,Best of 2013 Pt 1,http://www.earwolf.com/episode/best-of-2013-pt-1/,"Alas, we say farewell to another year but never fear because the best of 2013 episode of Comedy Bang! Bang! is here! There were sooo many good episodes this year that we had to step up the countdown to the next level. Making a rare appearance is special guest Paul F. Tompkins who helps Scott countdown numbers fifteen through twelve of the listener selected episodes of the year and some very special b-b-b-bonus-s-s-s clips. Stay tuned for Pt 2 to see which episodes YOU voted for made the list!",Paul F. Tompkins
2013-12-26,BO2013.2,Best of 2013 Pt 2,http://www.earwolf.com/episode/best-of-2013-pt-2/,The best of Comedy Bang! Bang! countdown continues with Scott and special guest Paul F. Tompkins as they go count down numbers eleven through seven of the best episodes YOU voted for along with additional b-b-b-bonus-s-s-s clips. Much love!,Paul F. Tompkins
2013-12-30,BO2013.3,Best of 2013 Pt 3,http://www.earwolf.com/episode/best-of-2013-pt-3/,It’s getting real close to the end with part three of the Comedy Bang! Bang! best of countdown as Scott and special guest Paul F. Tompkins count down numbers six through four as well as some b-b-b-bonus-s-s-s clips. Sit tight and look out for the final installment!,Paul F. Tompkins
2014-01-02,BO2013.4,Best of 2013 Pt 4,http://www.earwolf.com/episode/best-of-2013-pt-4/,And now the exciting conclusion to the best of 2013 countdown with special guest Paul F. Tompkins. What will be the number one episode of 2013? You’ll have to tune in to find out!,Paul F. Tompkins
2014-01-06,263,Hollywild,http://www.earwolf.com/episode/hollywild/,"House of Pies star Ben Schwartz aka Benny Schwaz is here to share his new year’s resolutions on another edition of Comedy Bing Bang Theory! After some wonderful duets, Coco Marx (Groucho Marx’s grandson) returns to tell us about his past in the celebrity sex tape biz, some of his new jokes, and his new office prank show. Then, the guys play the first Would You Rather of 2014! The End.","Ben Schwartz, Horatio Sanz"
2014-01-13,264,Creating A Krolliverse,http://www.earwolf.com/episode/creating-a-krolliverse/,"Stars of the Kroll Show, Nick Kroll & Jenny Slate are on this week’s Big Bang Theory Comedy to chat about the upcoming season of Kroll Show, how they met doing stand-up shows in New York, and their thoughts on public restrooms. Later, Liz and Pretty Liz of PubLIZity drop by to be totally honest about Pretty Liz’s new baby, pet names, and the current movie they are pitching. Honestly, it’s an amazing episode you don’t want to miss!","Nick Kroll, Jenny Slate"
2014-01-16,265,LIVE from RIOT LA,http://www.earwolf.com/episode/live-from-riot-la-2/,"Recorded LIVE from the Downtown Independent Theater as part of the RIOT LA festival, it’s a b-b-b-onus episode of Big Bang Theory Comedy! IT’S BEEN quite a while since high school student Traci Rearden has been on the show as she catches up with Scott about their time at prom. Harris Wittels also stops by with a fresh batch of Foam Corner and a mysterious vigilante hero hailing from Cumberbatch County, Florida simply known as JW Stillwater appears who fills us in on his life as a crime fighter. (Photos courtesy of Liezl Estipona)","Paul F. Tompkins, Lauren Lapkus, Harris Wittels"
2014-01-20,266,The Calvins Twins,http://www.earwolf.com/episode/the-calvins-twins/,"Comedy buds Taran Killam and Paul Brittain are back to chat about how to take compliments, if older people should be driving old cars, and why aren’t birds shitting on us all the time. Later, Bever Hopox and Chico Hands aka the Calvins twins gallop into the studio to discuss the ostentatious, hypervacious, dualicacious world of prized horse fighting. It’s a flip flopping good time!","Taran Killam, Paul Brittain"
2014-01-27,267,That Wasn’t It (I’m Back) [Hee Hee],http://www.earwolf.com/episode/that-wasnt-it-im-back-hee-hee/,"Hee Hee’s back! While waiting for fan favorite Jerrod Carmichael to show up, head writer/executive producer of the Comedy Bang! Bang! TV show & G.O.A.T. freestyle rapper Neil Campbell stops by along with the return of a reincarnated Michael Jackson from Hell. They’ll discuss Men In Black, Captain EO, and a brand new MJ tour right before playing a phenomenal game of Would You Rather. Hee! Hee!","Jerrod Carmichael, Neil Campbell, Mookie Blaiklock"
2014-01-30,268,What Does the Fonz Say?,http://www.earwolf.com/episode/what-does-the-fonz-say/,"Never Not Funny host Jimmy Pardo is back to chat about Twitter snitches, how much money he made in 1990, and his award winning podcast Never Not Funny joining Earwolf on today’s b-b-b-onus episode of Comedy Bing Bong Theory! Then, Voda the Gypsy has hunted Scott down for some unfinished business regarding a past encounter at the apple section of a Ralphs grocery store. Plus, the return of Riddle Me This!","Jimmy Pardo, Betsy Sodaro"
2014-02-03,269,Smaug’s Kickstarter,http://www.earwolf.com/episode/smaugs-kickstarter/,"You must know by now that Doug Benson loves movies, dining with Karen, and getting Doug right? Doug & cartoonist/author Paul Hornschemeier join Scott to talk about Paul’s new book “Artists Authors Thinkers Directors,” their all time favorite movies, and the Grammys. Later, Smaug the Dragon swoops in to share his distaste with his portrayal in the Hobbit films, tell us about his Kickstarter, and to play some of his folk parody songs. Plus, farts are discussed during a game of Would You Rather!","Doug Benson, Paul Hornschemeier, Matt Besser"
2014-02-10,270,Off The Grid,http://www.earwolf.com/episode/off-the-grid/,"One half of The Pepper Men, Jon Daly is here to discuss all things RHCP on today’s Comedy Bing Bong! Jon tells us about his tribute track to the Red Hots and dives deep into the Superb Bowl Halftime show controversy. Then, Scott & Jon start to go through the Chili Peps’ discography when suddenly an “off the grid” Jesse “The Mind, Body, and Soul” Ventura maneuvers into the studio to share some explosive information. Check out Jon’s tribute to RHCP aka “ABRACADABRALIFORNIA” over at http://rhcp2014.com/","Jon Daly, James Adomian"
2014-02-13,271,Tiny Little Boy Parts,http://www.earwolf.com/episode/tiny-little-boy-parts/,"Comedian extraordinaire, fan favorite, and new dad Nick Thune returns on this week’s b-b-bonus Comedy Bing Bong! Smash cut to Nick giving us a conclusion to his neighbor saga, explaining how he thought his baby boy was going to be a baby girl, and telling us about his new hour special Folk Hero (available on Netflix on February 18th). Cut to Nick & Scott’s agent Meredith Coldwell dropping by to give them some career advice. Slow fade into a high stakes game of Would You Rather!","Nick Thune, Molly Bretthauer"
2014-02-17,272,Sex Party Season,http://www.earwolf.com/episode/sex-party-season/,IT’S BEEN a long time since the previously married Garry Marshall & Gillian Jacobs have been on Comedy Bean Bag but now they’re here to set things straight. Will Gilli (sorry!) ever get stinkin’ rich? What gets Underworld series director Len Wiseman’s juices going? Will they be able to get Garry back to his own dimension? Tune in to find out you fool!,"Gillian Jacobs, Paul F. Tompkins"
2014-02-24,273,Vape Cod,http://www.earwolf.com/episode/vape-cod/,"Parks and Recreation’s Jim O’Heir makes his way from Pawnee for his debut appearance on today’s Comedy Bing Bong! Jim takes us through the many masks he wears as an actor and explains how the audition he did for the role of Ron Swanson lead to the creation of his character Jerry Gergich. Then, Shelly Driftwood returns to share some Hollywood animal secrets and tell us about his new business venture located in Venice. YOLO!","Jim O'Heir, Horatio Sanz"
2014-03-03,274,"Oh, Golly!",http://www.earwolf.com/episode/oh-golly/,"Get ready for some dating stories from the life of our good friend Jason Mantzoukas on today’s Comedy Bang Bang! Just as we get into Jason’s love life, an entertainer by the name of Gil accompanied by his puppet Golly stop by the studio. But something is odd about Gil & Golly. Could there be more than meets the eye (or in this case ear)? You’ll have to tune in to find out!This episode is sponsored by GoToMeeting.com & Stamps.com: Use promo code BANGBANG for a free trial.","Jason Mantzoukas, Andy Daly"
2014-03-10,275,LIVE from SXSW 2014,http://www.earwolf.com/episode/live-from-sxsw-2014/,"This week’s Comedy Bang Bang was recorded live at the South by Southwest Festival 2014 in Austin, Texas with fan favorite Jonah Ray and soon to be fan favorite Adam Cayton-Holland! Also, The Sheriff of Nottingham makes a harrowing return as he crashes the show the only way a fictional character from the Robin Hood universe can. With style! Bow. Bow. Chicka Chickaaaa.This episode is sponsored by:GoToMeeting.com, LegalZoom, & Stamps.com: Use promo code BANGBANG for a free trial.Hulu Plus: Go to www.huluplus.com/comedy for an extended free trial.Audible. Go to www.audible.com/bangbang for a free audio book and free trial.","Jonah Ray, Adam Cayton-Holland, James Adomian"
2014-03-13,276,LIVE from SXSW 2014 II,http://www.earwolf.com/episode/live-from-sxsw-2014-ii/,"It’s time for another b-b-b-bonus episode of Comedy Bang! Bang! recorded live at the South by Southwest Festival! Featuring co-host/intern Gino Lambardo and one of America’s favorite comedians Matt Braunger. But that’s not all, Scott’s childhood friend Hooch the Mooch drops by to take anything he can including a game of Would You Rather. Hurry and listen before Hooch takes this episode away! This episode is sponsored by:Naturebox: Go to www.naturebox.com/bangbang for 50% off your first box of delicious snacks.Audible: Go to www.audible.com/bangbang for a free audio book and 30 day free trial.","Matt Braunger, Matt Besser, Jon Gabrus"
2014-03-17,277,Comedy Bang Me!,http://www.earwolf.com/episode/comedy-bang-me/,"Are you ready for some pet peeves from TV’s own Chelsea Peretti? Things heat up on a Bang! Bang! After Dark as Chelsea gets deep about her thoughts on rental cars, dookie emojis, and DSLs. That’s not all, we know you’ve been missing record producers Benny & Barrett Bachelor aka The Bachelor Brothers, babe. So they’re back by popular demand and to make a big announcement baby! This episode is sponsored by:Naturebox: Go to www.naturebox.com/bangbang for 50% off your first box of delicious snacks.GoToMeeting.com & Stamps.com: Use promo code BANGBANG for a free trial.","Chelsea Peretti, Paul Rust, Neil Campbell"
2014-03-24,278,Only Tones,http://www.earwolf.com/episode/only-tones/,"It’s a special March Music edition of Comedy Bean Bag as Matt Berninger of The National & Rhett Miller of the Old 97’s get candid about being lead singers all while the Old 97’s play live versions of songs from their new album “Most Messed Up.” Later, entrepreneur George Zimmer appears in a cloud of cigar smoke and under the guise of a silhouette to tell us about being fired from Men’s Wearhouse. Then, fellow lead singer Russell Crowe of 30 Odd Foot of Grunts drops by to give us some behind the scenes info on his upcoming film Noah. You’re going to like what you hear in this episode. I guarantee it. Check out The National’s rockin’ documentary Mistaken For Strangers in theaters & VOD on Friday, March 28th. Go to http://mistakenforstrangersmovie.com/ for more info! This episode is sponsored by:GoToMeeting.com: Go to www.gotomeeting.com and use promo code BANGBANG for a free trial.Hulu Plus: Go to www.huluplus.com/comedy for an extended free trial.Harry’s: Go to www.harrys.com and use promo code BANGBANG for a free four pack of blades with your first purchase.AMC’s Turn: Tune in for the premiere on Sunday April 6, 9/8c on AMC","Old 97's , Matt Berninger, James Adomian"
2014-03-31,279,Reverse April Fools,http://www.earwolf.com/episode/reverse-april-fools/,"This week’s Comedy Bing Buh has Scott & co-host Traci Rearden welcome back Patton Oswalt to answer some burning questions in honor of his new special Tragedy Plus Comedy Equals Time. How many guns should a person own? What exactly is a reverse April Fools? Should Patton bring back his first joke? All of these questions are answered plus a new visitor from a planet far far away by the name of Qthor drops by to get some tips on living on Earth. Click here http://bit.ly/1gNR8YX  to pre-order Patton’s new CD/DVD Tragedy Plus Comedy Equals Time on iTunes.  This episode is sponsored by: Naturebox: Go to www.naturebox.com/bangbang for 50% off your first box of delicious snacks. WarbyParker: Go to www.warbyparker.com/bangbang for free 3-day shipping. VEEP: Tune into the season 3 premiere on Sunday, April 6th. 10:30/9:30c on HBO","Patton Oswalt, Lauren Lapkus, Will Hines"
2014-04-07,280,DuALity,http://www.earwolf.com/episode/duality/,"You’re getting two Als for the price of one as “Weird Al” Yankovic & Alan Thicke return on today’s Comedy Bean Bag! There will be talk of juke boxicals, what we should expect from the next “Weird Al” album, and Alan debuts his new song parody. Plus, a remarkable game of Riddle Me This you won’t wanna miss! This episode is sponsored by: Squarespace: Use offer code fourth for a free trial and 10% discount. Audible: Go to www.audible.com/bangbang for a free audio book and 30 day free trial.","Weird Al Yankovic, Paul F. Tompkins"
2014-04-14,281,Bro Boarders,http://www.earwolf.com/episode/bro-boarders/,"Let’s turn our gaze away from Los Angeles and move over to Washington D.C. which is where HBO’s Veep takes place and Matt Walsh & first timer Tim Simons are both HBO actors in. They’ll define political terms, describe the accents from their hometowns, and reveal some xclusies about Veep. Plus, a chill boarder by the name of XJR& rolls on in the studio to tell us about his charity. We’re not karate kidding you when we say this is an episode you don’t wanna miss!  This episode is sponsored by: The Boondocks Season 4 premiering Monday, April 21st at 10:30pm on Adult Swim GoDaddy.com: Click here for $2.95 own your own dot COM","Matt Walsh, Timothy Simons"
2014-04-21,282,Wompster’s University,http://www.earwolf.com/episode/wompsters-university/,"WOMP IT UP! CBB intern Marissa Wompler & her life coach Miss Listler are back to catch us up on what’s been going on in their life since Marissa’s birthday pool party. We’ll hear how their recent college visits in Washington D.C. have gone, how Marissa caught her step dad Seth in the middle of a jerk sesh, and why Eric “Gutterballs” Gutterman is out of the picture. So make yourself a DiGiorno cream cheese sandwich and tune in for an episode full of survival tips, accents, and of course womping up the jamz!  This episode is sponsored by Last Week Tonight with John Oliver. Tune into the premiere on Sunday, April 27th. 11/10pm central on HBO.","Jessica St. Clair, Lennon Parham"
2014-04-28,283,The 5th Anniversary Show!,http://www.earwolf.com/episode/the-5th-anniversary-show/,"IT’S BEEN 5 years of Comedy Bang Bang: The Podcast and all your favorites have returned for a bro out sesh! Get ready to experience our unbelievable open door policy as friends of the show Marissa Wompler, Miss Listler, Jason Mantzoukas, and Traci Rearden stop by as well as a new friend by the name of Mattilda Besserina. That’s not all, Mike the Janitor returns to break in the new studio and the Bachelor Brothers are back with an all new business venture babe! This episode is sponsored by: Squarespace: Use offer code FOURTH for a free trial.  Stamps.com: Use offer code BANGBANG for a no risk trial and a $110 bonus offer.","Jessica St. Clair, Lennon Parham, Jason Mantzoukas, Lauren Lapkus, Matt Besser, Paul F. Tompkins, Paul Rust, Neil Campbell"
2014-05-05,284,A Thrilling CBB Adventure Hour,http://www.earwolf.com/episode/a-thrilling-cbb-adventure-hour/,Uh oh! It looks like actor extraordinaire Marc Evan Jackson from The Thrilling Adventure Hour has his second visit to Comedy Bang! Bang! cut short as a portal appears in the Earwolf studio and has transported some of the characters from The Thrilling Adventure into the real world. How will Scott & Marc deal with these multidimensional beings? Tune in to find out! This episode is sponsored by: Squarespace: Use offer code FOURTH for a free trial. Audible: Go to www.audible.com/bangbang for a free audio book and 30 day free trial. The WNYC app. Download it now from where ever you get your apps.,"Marc Evan Jackson, Mark Gagliardi, Paul F. Tompkins"
2014-05-08,285,Solo Bolo,http://www.earwolf.com/episode/solo-bolo/,"You asked for it and now you’ve got it! Ben Schwartz aka Benny Schwaz of House of Pies is here for a SOLO BOLO episode of Comedy Bang! Bang! What can you expect from a Solo Bolo? Tons of singing, classic impressions, and real talk between bros. So listen to this in the morning or listen to this at night because any time of day for Solo Bolo is alright! This episode is sponsored by: Cards Against Humanity HostGator: Use the offer code BANGBANG for 30% off web hosting.",Ben Schwartz
2014-05-12,286,Time Bobby 3,http://www.earwolf.com/episode/time-bobby-3/,"The man, the myth, the music maker Sir Andrew Lloyd Webber returns to Comedy Bing Bong only to encounter a 90-year-old gentleman complete with a full white beard by the name of Fourvel. Could this old chap be the same stabby lil’ orphan boy from the past? Tune in to find out!  This episode is sponsored by The WNYC app. Download it now from where ever you get your apps.","Bobby Moynihan, Paul F. Tompkins"
2014-05-19,287,Stinky Chips,http://www.earwolf.com/episode/stinky-chips/,"Portland comedian Shane Torres bursts his way into the first timers club on today’s Comedy Bang! Bang! Shane talks about his start in comedy in the land of Portland, his life after his previous appearance on the LIVE from Portland CBB ep, and possibly getting a nickname. Plus, substitute teacher Mizz Chips drops by to teach Scott and Shane a few things about former students. Now do YOUR homework and listen to this episode already! This episode is sponsored by: One Night Only: Don Rickles, Wednesday May 28th at 9, only on SPIKE. Sock Panda. Go to www.sockpanda.com and use offer code COMEDY for 50% off socks that don’t suck. The WNYC app. Download it now from where ever you get your apps. Stamps.com: Use offer code BANGBANG for a no risk trial and a $110 bonus offer.","Shane Torres, Lauren Lapkus"
2014-05-22,288,"Back to Barz, Back to Reality",http://www.earwolf.com/episode/back-to-barz-back-to-reality/,"Randy & Jason Sklar make their way from Sklarbro Country as they return to the land of Comedy Bang! Bang! on this week’s b-b-b-onus episode! The Sklarbros chat about their new comedy special “What Are We Talking About” which is available on Netflix instant streaming (as well as iTunes & Amazon.com), Chester Cheetah, the difficulties of parenting, and the good ol’ dating days. Then, celebrity gossip columnist Barzelona Marriott stops by to reveal what really happened during the Jay-Z & Solange elevator incident and much more that will make you go OMG. Plus, the dudes discuss if we should stick to one gender when eating animals during a game of Would You Rather!","Jason Sklar, Randy Sklar, Horatio Sanz"
2014-05-26,289,The Exorcism of Cake Boss,http://www.earwolf.com/episode/the-exorcism-of-cake-boss/,"Straight from the cake kitchen, our old buddy Buddy Valastro aka Cake Boss (Cake Boss!) returns to talk about the new changes in the Star Wars canon when suddenly his body is possessed. The spirit of the recently deceased narco-sculptor H.R. Giger is back from hell for some unfinished business and the only one who can send him back is Reverend Robert Parsimony. So tune in for the first ever exorcism in Comedy Bang! Bang! history!This episode is sponsored by:One Night Only: Don Rickles, Wednesday May 28th at 9, only on SPIKE. Sock Panda. Go to www.sockpanda.com and use offer code COMEDY for 50% off socks that don’t suck.","Paul F. Tompkins, Matt Gourley"
2014-06-02,290,Shed Busting,http://www.earwolf.com/episode/shed-busting/,"Comedian extraordinaire/friend of the show Todd Glass returns to Comedy Bang! Bang! and brings along the wonderful James Adomian for his first time ever appearance! The guys chat about the early days of the CBB live show (formerly CDR), Todd’s new book “The Todd Glass Situation,” and busting out of the shed in the comedy community. Then, painter George W. Bush stops by to talk about art and his interesting hidden past. So tune in because you never know if some of the former president’s pals will drop on by as well! This episode is sponsored by: Squarespace: Use offer code FOURTH for a free trial. Audible: Go to www.audible.com/bangbang for a free audio book and 30 day free trial.","Todd Glass, James Adomian"
2014-06-05,291,Summer Haunted House,http://www.earwolf.com/episode/summer-haunted-house/,"Better Call Saul’s Bob Odenkirk & Cabin Boy director Adam Resnick stop on by for a b-b-b-bonus Comedy Bang! Bang! Bob debuts his Johnny Carson impression, Adam reads an excerpt from his hilarious memoir Will Not Attend: Lively Stories of Detachment and Isolation, and author Thor Silverblatt stops by to ask a couple questions about Adam’s new book. Then, local advertisers Pammy and Earl Bixby drop by to announce their summer hours for their spooky haunted house in Connecticut. Warning: Listening to this episode might cause you to have a laugh attack.  This episode is sponsored by: Cards Against Humanity","Bob Odenkirk, Adam Resnick, Neil Casey, Fran Gillespie"
2014-06-09,292,DJs Are Sleaze Js,http://www.earwolf.com/episode/djs-are-sleaze-js/,"Obvious Child’s Jenny Slate and lead singer of the tUnE-yArDs, Merrill Garbus join forces to find out what they have in common as artists on today’s Comedy Bing Bong! Jenny tells us about her role in the new film Obvious Child as well as showcases her Arnold Schwarzenegger impression, Merrill gives a taste of what the new tUnE-yArDs album Nikki Nack sounds like, and Sappity Tappity, the drunk British rollerblading pine tree rolls on in for some harmonized singing. Plus, a fun game of Would You Rather? you won’t want to miss! This episode is sponsored by: Squarespace: Use offer code FOURTH for a free trial. Stamps.com: Use offer code BANGBANG for a no risk trial and a $110 bonus offer. Bonobos.com: Use offer code BANGBANG to get 20% off your first purchase.","Jenny Slate, Merrill Garbus, Jon Daly"
2014-06-12,293,Monster Muscles,http://www.earwolf.com/episode/monster-muscles/,"21 and 22 Jump Street directors Phil Lord & Chris Miller join Scott & intern Gino Lambardo for special emergency bonus episode of Comedy Bing Bong! We’ll get into Lord & Miller’s career from Clone High to The Lego Movie, find out how a sequel to 21 Jump Street came to be, and hear a xclusy on their new project. Later, Scott’s new personal trainer R.J. Rise runs into the studio to give everyone tips on how to get some monster muscles. Plus, everyone shines in a game of Riddle Me This!","Phil Lord, Chris Miller, Jon Gabrus, Eugene Cordero"
2014-06-16,294,Honk Shoo,http://www.earwolf.com/episode/honk-shoo/,"First timers Ian Edwards and number one corporate rock comedian Bernie Fretts jam out on today’s Comedy Bang Bang aka CBB! It wouldn’t be a true jam sesh without Marissa Wompler here to womp up the jamz as well as drop a bombshell on our heads. If that’s not enough, Bernie gives us an exclusive demonstration of his R-Rated Hypnotism act that is sure to not disappoint! Check out Ian Edwards’ first stand-up album “100% Half-Assed” over at www.teamcoco.com! This episode is sponsored by: Squarespace: Use offer code FOURTH for a free trial. Obvious Child. Go to www.obviouschildmovie.com for more info!","Ian Edwards, Brendon Small, Jessica St. Clair"
2014-06-19,295,I Turned It On For The Dog Penis,http://www.earwolf.com/episode/i-turned-it-on-for-the-dog-penis/,"The impresarios behind the hit web-series “Next Time on Lonny,” Alex Anfanger & Dan Schimpf are here along with today’s co-host Traci Rearden on a bonus Comedy Bing Bong! We’ll hear about the new season of Next Time on Lonny, the process behind Alex & Dan’s choose your own adventure episode, the first time they met at NYU many years ago, and catch up with Traci’s life & dreams. Plus, everyone checks out an insane dog video during a game of Riddle Me This! Check out “Next Time on Lonny” over at http://www.maker.tv/show/nexttimeonlonny. This episode is sponsored by: www.thebouqs.com: A simpler, gorgeous bouquet that lasts longer. Use offer code BANG BANG for free shipping at 15% off. Try Audio Books: Go to www.tryaudiobooks.com/bangbang for a free audio book. Audible: Go to www.audible.com/bangbang for a free audio book and trial.","Alex Anfanger, Dan Schimpf, Lauren Lapkus"
