date,number,title,url,desc,guests
2015-07-27,365,Bongo vs. Bongos,http://www.earwolf.com/episode/bongo-vs-bongos/,"Jason Heynong-Mantzoukas couldn’t be happier with the worldwide reception to Heynong Man so he’s back to bro-out with Scott about summer, a 3rd gender, and Star Wars. After they discuss the possibility of making Jason a genie who can grant one wish for charity, Marina Del Ray High health teacher Joe Bongo joins them to talk about his faculty band Rosebush Red, record an episode of Talkin’ Tang, and introduce them to his bongo playing alter-ego Jimmy Bongos. Plus, Jarles drops by to add yet another Classic Jarles moment to the CBB canon!","Jason Mantzoukas, Andy Daly, Paul F. Tompkins"
2015-08-03,366,Cafeteriapalooza,http://www.earwolf.com/episode/cafeteriapalooza/,"From setting fire to a couch on the Tonight Show to his groundbreaking first appearance on Comedy Bang! Bang! The one and only Bobcat Goldthwait is back to talk about catching up with his Police Academy pals, his new documentary Call Me Lucky following comedian Barry Crimmins, and his friendship with Robin Williams. Then, middle school cafeteria technician Frank Frank arrives to give us all the details on how creating Cafeteriapalooza will be the solution to bad behavior in the lunchroom. Later, Country-western songwriter Dusty Stevens stops by to promote his new album as well as talk about some of the famous jingles he’s helped write.","Bobcat Goldthwait, Joe Wengert, Will Hines"
2015-08-06,367,"Bits, Riffs, and Friendships",http://www.earwolf.com/episode/bits-riffs-and-friendships/,"The three best friends of comedy, Brett Gelman of Married & Dinner with Family with Brett Gelman and Brett Gelman’s Family, Tim Heidecker of Decker & On Cinema, and Jon Daly of Kroll Show & The Secret Life of Walter Mitty are back with bits and riffs galore on a bonus Comedy Bing Bong! Brett, Tim, and Jon reminisce of the good times they had an Italian restaurant and running into each other at the DMV before ranking comedians with Yay or Nay. Plus, Tim makes a special podcast related announcement in a CBB ‘sclusie!","Brett Gelman, Jon Daly, Tim Heidecker"
2015-08-10,368,Ric Bic For President,http://www.earwolf.com/episode/ric-bic-for-president/,"Wings! Video games! Married bros! Get ready to enter the man cave with Paul Scheer and Rob Huebel as they dish on married life, sick ideas for Halloween attractions, and their new Crash Test comedy special that took place on a 60 foot glass bus that rode around Los Angeles. After Paul & Rob head out for a bit, Presidential candidate Ric Bic and his campaign manager Dick Butterfield arrive to address Rick’s sexual scandal once and for all. Later, Rob & Paul come back in the studio for an electrifying game of Would You Rather! Remember to go check out the Crash Test special over at www.crashtestshow.com!","Paul Scheer, Rob Huebel"
2015-08-13,369,The Hotwives of Las Vegas,http://www.earwolf.com/episode/the-hotwives-of-las-vegas/,"What happens in Vegas gets made into a hilarious show starring Dannah Phirman, Danielle Schneider, Andrea Savage, and Casey Wilson! The Hotwives are back on a bonus CBB to talk about the Vegas strip, timezones, and Magic Mike XXL. Then, Denise, Leona, Ivanka, and Jenfer, the titular Hotwives of Vegas, arrive to promote hot new items you won’t be able to live without!","Andrea Savage, Casey Wilson, Dannah Phirman, Danielle Schneider"
2015-08-17,370,The Brochelor,http://www.earwolf.com/episode/the-brochelor/,"Earwolf and Wolfpop favorites Paul F. Tompkins and Matt Gourley join Scott to talk about some exciting news! Yes, we finally find out what their morning routines consist of in full detail but just as important, we get all the info on the updated HOWL app. We’ll hear all about the amazing new features including ad free episodes of your favorite Earwolf/Wolfpop shows as well as Howl Originals such as Superego: Forgotten Classics and more. Plus, stuntman Chin Dollhouse arrives to talk about some of the many famous stunts he has done that haven’t seen the light of day and best selling author Danielle Steele stops by to promote her new book “Chimney Smoke Hairdo.” Download the Howl app or go to Howl.FM and use the promo code CBB for a one month free trial of Howl Premium!","Paul F. Tompkins, Matt Gourley"
2015-08-24,371,You Got PreDICted!,http://www.earwolf.com/episode/you-got-predicted/,"Do you believe in psychic abilities? The Flagen sisters, Juniper, Peony, Hyacinth, and Shrub stop by the studio on their carnival tour to predict Scott’s future as well as the future of Fresno. Have you ever thought what it would be like to have Jemaine Clement of Flight of the Conchords as your dad? Jemaine also arrives to talk about being a dad in his new film People Places Things, his brand new limited series on HOWL called The Mysterious Secrets of Uncle Bertie’s Botanarium, and whether he believes in Santa Claus or not. You’ll never guess which it is unless you’re a psychic or listen!","Jemaine Clement, Lauren Lapkus, Mary Holland, Stephanie Allynne, Erin Whitehead"
2015-08-31,372,Motown Tea,http://www.earwolf.com/episode/motown-tea/,"It’s a very musical episode of Comedy Bing Bong as the legendary John Lennon of The Beatles joins Scott as this week’s co-host and helps welcome singer Diane Coffee aka Shaun Fleming to play tracks off his new album “Everybody’s A Good Dog.” They’ll also chat about Motown, Fleming’s favorite song of all time, and the Willennium before rock ‘n’ roll photographer Skip Garcia arrives. Skip takes us through the different kinds of photos he takes as he tells us all we need to know about his new photography book has “I Walk Among Trees.” Plus, Diane Coffee plays some acoustic ‘sclusies from his new album!","Diane Coffee, Mike Hanford, Horatio Sanz"
2015-09-07,373,Vocal Fry,http://www.earwolf.com/episode/vocal-fry/,"Modern Family’s Eric Stonestreet joins the esteemed first timers club on this week’s Comedy Bang! Bang! Eric expertly tells us how to troll Instagram, the lessons he learned from Tina Fey & Del Close in Chicago, and why a spontaneous Z-snap might have helped him in his audition for the role of Cameron on Modern Family. Later, our favorite musical friends Victor & Tiny return with a new friend by the name of Willard “Willy” Mapleton who helps Scott & Eric with their accent work. Impress your Australian friends with this free speech lesson!","Eric Stonestreet, Brendon Small"
2015-09-10,374,Tick Tock Clawk,http://www.earwolf.com/episode/tick-tock/,"Start the clock! Maxwell Keeper aka The Time Keeper, an observer and celebrator of time is back on a bonus Comedy Bing Bong to spend some precious time with Scott and company. They’ll have a grand ol’ time with the world’s most dangerous comedian Paul Rust as he debuts some fresh New No-Nos as well as Old Yes-Yeses. A young lad by the name of Marco also appears with a mission to look for donations for special trip and sticks around for a game of Would You Rather that will be talked about for future generations. Tick tock!","Neil Campbell, Paul Rust, Fran Gillespie"
2015-09-14,375,Wompler’s REAL 17th B-Day Womptacular,http://www.earwolf.com/episode/womptacular-2015/,"Finally, the highly anticipated CBB episode you’ve been waiting for is here! LIVE from the Marina Del Ray American Legion Hall, it’s Marissa Wompler’s REAL 17th Birthday Womptacular! Joining in the celebration is Scott, Miss Listler, Marissa’s step dad Dr. Seth Wompler, Dr. Lionel Drioche, Traci Reardon, and Eric “Gutterballs” Gutterman. Are Marissa and Traci on good terms? Will Eric “Gutterballs” Gutterman forever say goodbye? Who else will drop by the party? WOMP UP the JAMZ!","Jessica St. Clair, Lennon Parham, Brian Huskey, Seth Morris, Lauren Lapkus, Jason Mantzoukas"
2015-09-17,376,Romantic Tommy D,http://www.earwolf.com/episode/romantic-tommy-d/,"Wonderful musician Peaches makes her CBB debut along with the return of contest winner Claudia O’Doherty who serves as co-host on this week’s bonus Comedy Bing! Bong! Peaches gets us more acquainted with her music by performing songs from her latest album “Rub” and we hear the new Rom Coms that Claudia has been working on at her new job. Plus, classic Rock aficionado Clayton Purdy stops by to recommend some great music that you should definitely be listening to if you’re not already!","Peaches , Claudia O'Doherty, Will Hines"
2015-09-21,377,Good Night In The Morning,http://www.earwolf.com/episode/good-night-in-the-morning/,"A couple of Canucks, Tatiana Maslany and Kristian Bruun give us the ‘sclusies on the upcoming fourth season of their hit TV series Orphan Black on this week’s Comedy Bing Bong! They’ll also share the stylish ways they’ve been getting around LA before being introduced to a couple of other celebs, radio hosts Chazmin and Sunny of Good Night In The Morning. Chazmin and Sunny bring the sweetness, charm, and hilarity that their very popular radio show is known for across the nation. It’s an episode that clones and non-clones can both enjoy!","Tatiana Maslany, Kristian Bruun, Paul F. Tompkins, Lauren Lapkus"
2015-09-28,378,Mailer Daemon,http://www.earwolf.com/episode/mailer-daemon/,"Jason Heynong-Mantzoukas and Comedy’s own Nick Kroll arrive in studio to help Scott get to the bottom of the origin of Mailer-Daemon on this week’s Comedy Bing Bing! However, through their online research they have summoned the Mailer Daemon himself, a demon who has possessed the Ask Jeeves butler. Now the demon is here to serve but also change the CBB universe forever! Can anything be done to stop him? Tune in to find out!","Jason Mantzoukas, Nick Kroll"
2015-10-05,379,Realies and Fictionals,http://www.earwolf.com/episode/realies-and-fictionals/,"Alia Shawkat, Angela Trimbur, and Adam DeVine stop by to give Scott and intern Gino a behind the scenes look into their new Horror Comedy film The Final Girls on this week’s Comedy Bang! Bang! We’ll find out what it’s like to be slashed in a slasher film, the kind of craft service on the movie’s set, and the last time everyone cried. Later, Cutie Cake, the Angel of Cuteness herself appears in studio to create some cute things right before everyone’s eyes!","Alia Shawkat, Angela Trimbur, Adam DeVine, Jon Gabrus, Pamela Murphy"
2015-10-08,380,A Colinary Journey,http://www.earwolf.com/episode/colinary-journey/,"It’s a Fuller House as fan favorite Colin Hanks returns to the show along with Jesse Hughes and Josh Homme of Eagles of Death Metal on this week’s B-B-B-ONUS Comedy Bang! Bang! Join them as they reminisce about the good ol’ days of getting music at a record store and the first time the two JH’s became chums. Later, everyone goes on a Colinary journey as they sample new inventions from Maximilian Lugner and Dr. Hiro Tokyo, the creators of the Halloween Whopper.","Colin Hanks, Eagles of Death Metal , Matt Walsh, Brian Huskey"
2015-10-12,381,Kitchen Stand-Up,http://www.earwolf.com/episode/kitchen-stand-up/,"Bad boys Nathan Fielder and Anthony Jeselnik aka two-thirds of the Titans of Comedy return to speak on friendship, the difference between what’s real and a joke on Nathan For You, and the meaning behind the title of Anthony’s new Netflix special “Thoughts and Prayers.” Then, author Terry Burkhalter stops by to tell us all about his new cookbook Southern Plates and to perform one of his kitchen stand-up closers. Plus, we hear what Nathan got for lunch during a game of Would You Rather!","Nathan Fielder, Anthony Jeselnik, Drew Tarver"
2015-10-19,382,Doing It The Savage Way,http://www.earwolf.com/episode/doing-it-the-savage-way/,"TV’s Fred Savage of The Grinder and comedian extraordinaire Wayne Federman join Scott to give listeners big auditioning tips on this week’s Comedy Bing Bong! We’ll hear all about Wayne’s new 3-CD comedy album “The Chronicles of Federman,” Fred’s new TV show The Grinder which is one of Scott’s Pick to Click, and what we should do to prepare for El Nino. Plus, Swiss narco-sculptor H.R. Giger returns to tell us why he got kicked out of hell!","Fred Savage, Wayne Federman, Matt Gourley"
2015-10-26,383,Return to Suicide House Part Boo,http://www.earwolf.com/episode/suicide-house-part-boo/,"A frightening occurrence has fallen upon the Earwolf Studios once again to turn it into the Werewolf Studios deep within the Suicide House! The ghoulish brothers Beuford and Messmore le Barron are back to make Scott KnottsScaryMan’s life a living hell and musician Leo Carpazzi along with his granddaughter Scaroline also return to debut a ghoultide composition by the name of “We Wish You A Scary Christmas.” Just when you thought all hope is lost, mad scientist Dr. Traygo returns to give us the good news that his creeeeepies are no longer lost. Plus, it wouldn’t be a Comedy Fang! Fang! without a special Hallowscream Freestyle Rap Contest!","Brett Gelman, Jon Daly, Nick Wiger, Paul Rust, Caroline Anderson"
2015-11-02,384,Numbers Cannot Lie,http://www.earwolf.com/episode/numbers-cannot-lie/,"Jason Heynong-Mantzoukas is back to co-host along with Ghost host Scott on this week’s Comedy Bang! Bang! Join them as they discuss important topics such as how boobs have changed over the years, experiencing concerts of the past & future as a ghost, and cars. Later, statistician Atherton Witherflower arrives to tell us everything we need to know about the upcoming 2016 Election. Who is going to be the Democrat and Republican nominees? Who will win the Presidency of the United States? The answers are in the numbers because numbers don’t lie!","Jason Mantzoukas, Paul F. Tompkins"
2015-11-09,385,The Beatles of Cults,http://www.earwolf.com/episode/the-beatles-of-cults/,"Stand-up comedian extraordinaire John Mulaney is back on this week’s Comedy Bang Bang! John and Scott break down the Ebenezer Scrooge costume, reflect on why weird rumors are not circulated about modern celebs, and talk about John’s starring role in his new Netflix special “The Comeback Kid.” Then, local business woman Big Sue arrives with terrible news about her business “Carpets Rugs Down There” and religious figure Nancy K stops by to talk everyone into joining a very special cult.","John Mulaney, Lauren Lapkus, Betsy Sodaro"
2015-11-16,386,Titbit for Tatbit,http://www.earwolf.com/episode/titbit-for-tatbit/,"It’s Comedy Bang Bang’s first ever Double Header! Some times, half + half just equals one, and this episode is one of those times. In the first half, Bob Odenkirk stops by to talk “Better Call Saul” and extra special guest Reverend Robert Parsimony joins us to help save our souls. Then in the second half, David Cross stops by the talk about the new episodes of “With Bob & David” and special guest life coach Zin Bradley stops by to help us all get our lives back on track.","Bob Odenkirk, David Cross, Mike O'Brien, Paul F. Tompkins"
2015-11-19,387,Most Multiple Personalities,http://www.earwolf.com/episode/most-multiple-personalities/,"Singer-songwriter John Grant joins Scott to preview new songs off of his new record “Grey Tickles, Black Pressure” on today’s B-B-B-ONUS Comedy Bang Bang! We also meet Tom Jimson, the man who has the record for the most multiple personalities of all time ranging from old prospector to a giant Miyazaki baby. Plus, Scott’s cousin Delna stops by in hopes of getting advice on how to turn her bad life around.","John Grant, John Gemberling, Jocelyn DeBoer"
2015-11-23,388,Breath Before Death,http://www.earwolf.com/episode/breath-before-death/,"This year we give thanks to the songwriting titans and fan favorites Neko Case and John Lennon as they return on this week’s Comedy Bang! Bang! Neko tells us all about her new box set “Truckdriver, Gladiator, Mule,” John explains his unfortunate past with Black Friday, and both Neko & John sing a special rendition of “Santa Baby.” Then, friend of the show Mookie Blaiklock stops by to talk about his new web series Please Slate Your Name when suddenly an unseeable force takes over his body.","Neko Case, Mike Hanford, Mookie Blaiklock"
2015-11-30,389,Travel Agent-Si!,http://www.earwolf.com/episode/travel-agent-si/,"Guestress of honore Mary Elizabeth Ellis of FOX’s The Grinder shares what the hardest part of being an actor is on this week’s Comedy Bang Bang! Mary also tells us about becoming a judge, what showbiz job she would take in an alternate universe, and a possible new storyline for her character on The Grinder. Then, Scott’s travel agent Randy Travels arrives to check up on Scott’s last vacation, help Mary schedule her very first vacation, and explain why he learned english from a cartoon public access Hot Dog in NYC. Later, Dr. Frankie Beans stops by to talk about what lead him to be named 2015’s Most Improved Surgeon of the Year.","Mary Elizabeth-Ellis, Dan Lippert, Drew Tarver"
2015-12-07,390,"The Oh, Hello Show",http://www.earwolf.com/episode/the-oh-hello-show/,"Stand-up extraordinaire Eugene Mirman aka 1/3 of the Titans of Comedy returns to tell us all about his new 9-volume comedy album “I’m Sorry (You’re Welcome)” on this week’s Comedy Bang Bang! Eugene goes into what you can find in his new comedy album (including 45 minutes of himself crying), describes exactly what is a “Fuckscape,” and ponders the possibility of a Talking Bob’s Burgers after show. Then, George St. Geegland & Gil Faizon fly in from New York to talk about their holiday plans, the 60s, and their current Off-Broadway run of their new show “The Oh, Hello Show.” Don’t miss it or you might get Tuna’d!","Eugene Mirman, John Mulaney, Nick Kroll"
2015-12-14,391,2015 Holiday Spectacular,http://www.earwolf.com/episode/2015-holiday-spectacular/,"2015 Holiday SpectacularHo! Ho! Ho! BLECH! It’s the most wonderful TIME of the year, the Holiday episode of Comedy Bang! Bang! is upon us and our most dearest of friends (and a complete stranger) stop by including intern Gino Lambardo, John Lennon of The Beatles, Ho Ho the naughty Elf, The Time Keeper, Baron Andrew Lloyd Webber, and small time business owner David Bunting. Pa drum drum drum drums!","Paul F. Tompkins, Lauren Lapkus, Jon Gabrus, Mike Hanford, Neil Campbell, Will Hines"
2015-12-17,392,The Holiday Womptacular,http://www.earwolf.com/episode/the-holiday-womptacular/,"It’s a Christmas miracle! LIVE from the Marina Del Ray Public High School Library is a Holiday Womptacular with Marissa Wompler, Miss Listler, Marissa’s step dad Dr. Seth Wompler,  Eric “Gutterballs” Gutterman, and many more surprise guests. How has Marissa held up after her recent breakup? Will she finally meet her dad? (Probably not.) WOMP UP the Yuletide JAMZ!","Jessica St. Clair, Lennon Parham, Brian Huskey, Jason Mantzoukas, Seth Morris, Danielle Schneider, Jon Daly"
2015-12-21,BO2015.1,Best of 2015 Pt. 1,http://www.earwolf.com/episode/best-of-2015-pt-1/,As we say farewell to another year of Comedy Bang! Bang! we look back at some of the favorite moments of 2015. Joining Scott is Paul F. Tompkins of SPONTANEANATION to countdown numbers fourteen through eleven of the Best CBB episodes of 2015 as voted by YOU the listener. Stay tuned for Pt. 2 dropping on Christmas Eve!,Paul F. Tompkins
2015-12-24,BO2015.2,Best of 2015 Pt. 2,http://www.earwolf.com/episode/best-of-2015-pt-2/,The best of Comedy Bang! Bang! 2015 continues with Scott and Paul F. Tompkins as they count down numbers ten through seven of the best episodes YOU voted for! Merry Christmas to you all and we’ll see you next week for Pt. 3!,Paul F. Tompkins
2015-12-28,BO2015.3,Best of 2015 Pt. 3,http://www.earwolf.com/episode/best-of-2015-pt-3/,"The Best of Comedy Bang! Bang! 2015 countdown continues with Scott and special co-host Paul F. Tompkins as they go through numbers six, five, and four on the list of the best episodes YOU voted for. Please enjoy and we will see you on New Year’s Eve for the final installment!",Paul F. Tompkins
2015-12-31,BO2015.4,Best of 2015 Pt. 4,http://www.earwolf.com/episode/best-of-2015-pt-4/,"At long last, the conclusion of the Best of Comedy Bang! Bang! 2015 countdown with special co-host Paul F. Tompkins is here with your Top 3 episodes of the entire year. Thanks for listening and Happy New Year!",Paul F. Tompkins
2016-01-04,393,Peanuts Awareness,http://www.earwolf.com/episode/peanuts-awareness/,"House of Pies star Ben Schwartz and SNL alum Horatio Sanz keep the CBB tradition alive as they help Scott ring in the new year! Ben tells us about being a Star Wars: Force Awakens voice over consultant for BB-8, Horatio shares some of the cut Chewbacca lines from the film, and everyone has some fun with Frankie Goes to Hollywood. Then, small business owner Ted Ronson stops by to talk about about Peanuts Awareness Month. Plus, everyone participates in the first Would You Rather? of 2016!","Ben Schwartz, Horatio Sanz"
2016-01-11,394,Wisconsin Sugar Babies,http://www.earwolf.com/episode/wisconsin-sugar-babies/,"Our old friend Zach Galifianakis joins Scott and Scott’s nephew Todd on this week’s Comedy Bang! Bang! After Scott & Todd catch up and play “What’s That Phrase?”, Zach tells us about his new FX show “Baskets” and considers Todd to be his new stand-up opening act. Later, U.S. citizen Don Darling stops by all the way from Wisconsin to tell us all about being a Sugar Daddy.","Zach Galifianakis, Lauren Lapkus, Tim Baltz"
2016-01-18,395,Yupparently,http://www.earwolf.com/episode/yupparently/,"Stand-up extraordinaire and official CBB friend of the show Whitney Cummings finally makes her first appearance on this week’s Comedy Bang! Bang! Whitney tells us all about her new HBO special “I’m Your Girlfriend,” what it means to be diagnosed as a love addict, and an important comedy lesson she learned early in her career. Then, Hollywood producer Gene Rottenberry arrives to talk about his new space show “Star Confirmation.” Later, Scott’s former next door neighbor Linda Gravel stops by to reconnect with Scott and reminiscence about his childhood.","Whitney Cummings, John Gemberling, Mary Holland"
2016-01-21,396,The Intern Challenge,http://www.earwolf.com/episode/the-intern-challenge/,"The time has come to determine who will officially be Scott’s intern. Intern Gino Lambardo and Intern Marissa Wompler go head-to-head in the very first Comedy Bang! Bang! Intern Challenge judged by none other than CBB’s first ever guest Rob Huebel of The Descendants, Childrens Hospital, and Crash Test fame. Two enter and one will leave the intern duties for good. Who will be victorious? Tune in to find out!","Rob Huebel, Jon Gabrus, Jessica St. Clair"
2016-01-25,397,My Silly Moss Man,http://www.earwolf.com/episode/my-silly-moss-man/,"“Weird Al” Yankovic joins Scott as a special co-host and to make a very major announcement on this week’s Comedy Bang! Bang! Child actress Dimples also visits the studio to talk about her new show “My Silly Step-Sister,” her foley artist work, and her dark home life. Then, spokesperson Cody Calavera stops by to raise awareness on what it means to be a “Moss Man.”","Weird Al Yankovic, Joe Wengert, Lauren Lapkus"
2016-02-01,398,Prayer Orgy,http://www.earwolf.com/episode/prayer-orgy/,"A very treasured special guest who shall not be named joins Scott to do some vocal exercises, play a game of “False or True?”, and to talk about departing The Daily Show for her new TBS show Full Frontal with Samantha Bee. Later, entrepreneurs Craig and Ron Bieber of the very famous Bieber family stop by to workshop their commercial jingles.","Samantha Bee, Drew Tarver, Ryan Gaul"
2016-02-04,399,Trump vs. Bernie,http://www.earwolf.com/episode/trump-vs-bernie/,Legendary comedian Gilbert Gottfried shares stories from his early days of doing stand-up at the age of 15 to his days at Saturday Night Live to his stint on Alan Thicke’s late night talk show Thicke of the Night and much more as he joins Scott on a new Comedy Bang! Bang! Gilbert and Scott also chat with Presidential candidates Donald Trump and Bernie Sanders as they stop by during their 2016 Debate Tour of the country. Check out if the Trump Vs. Bernie tour is coming to a city near you @ www.trumpvsbernie.com!,"Gilbert Gottfried, James Adomian, Anthony Atamanuik"
2016-02-08,400,The War on Surfing,http://www.earwolf.com/episode/the-war-on-surfing/,"Heynong Man! Jason Mantzoukas aka J-Dog aka Jeffrey Characterwheaties joins Scott to celebrate the 400th episode of Comedy Bang! Bang! Tune in and turn out to hear Scott & Jason discuss the status of Talkin’ ‘Tang, their love of Hamilton, and The Heynong Man Challenge. We then say “What’s Up?” to our old friend Hot Dog, champion water skiier and aspiring member of Sha Na Na. Hot Dog takes time away from his active war against surfers to hit us with a major bombshell.","Jason Mantzoukas, Andy Daly"
2016-02-15,401,LOVE Is Thicker Than Water,http://www.earwolf.com/episode/love-is-thicker-than-water/,"The co-creator and co-stars of the new Netflix original series LOVE, Paul Rust and Gillian Jacobs return on this week’s Comedy Bang! Bang! They’ll talk all about their new show in full detail (including how many butts we will see), Gillian shares what was appealing about her role as an actress, and Paul brings some fresh New No-Nos. Then, composer and lyricist Alan Thicke of Growing Pains arrives to write a theme song for Paul and Gillian’s show LOVE.","Paul Rust, Gillian Jacobs, Paul F. Tompkins"
